CREATE TABLE t (a int) USING columnstore;
INSERT INTO t VALUES (1), (2), (3);
INSERT INTO t VALUES (123) RETURNING a + 1;
 ?column? 
----------
      124
(1 row)

UPDATE t SET a = -a RETURNING a + 1;
 ?column? 
----------
        0
       -1
       -2
     -122
(4 rows)

DELETE FROM t RETURNING a + 1;
 ?column? 
----------
        0
       -1
       -2
     -122
(4 rows)

DROP TABLE t;
